	{
		"title": "Edit meta-data schema",
		"content": "As a repository manager I want to edit meta-data schema on a meta-branch",
		"status": "todo",
		"effort": 5,
		"acceptance_criteria":
		[
			{ "criteria": "Be able to run 'git tabs meta-branch'", "status": "not tested" },
			{ "criteria": "'git tabs meta-branch' need a json-schema file as parameter", "status": "not tested" },
			{ "criteria": "json-schema file must be valid", "status": "not tested" },
			{ "criteria": "Branch named after json-schema file must be rewritten", "status": "not tested" },
			{ "criteria": "Commit the new file to the branch", "status": "not tested" }			
		]
			
	}	
